{
  "schema_version": "track-a-reference-catalog/v1",
  "knowledge_release_id": "track-a-educational-design-knowledge-v1",
  "source_workbook": "outputs/itchio-sheet/itchio-educational-if-candidates-v1.0.xlsx",
  "source_sha256": {
    "workbook": "2bfc70fc09de8ed558b8cc76c2b8334f263885e33d8f57a0fcd589aa52f1904b",
    "coding_annotations": "c5443d8a43f2d28a257db9a32efed20c156c47a9a35450a467d485385d231fef",
    "design_cards": "e50fd724dcd6bce7ca18c4aa3a3f6730f7d5471717ccd715fdf4447018e2da7f"
  },
  "reference_count": 122,
  "references": [
    {
      "knowledge_id": "kc-itchio-0006-v1-1",
      "project_id": "itchio-0006",
      "display_title": "Stink Bug Plague",
      "platform": "itch.io",
      "public_url": "https://zephyo.itch.io/stink-bug-plague",
      "known_dimensions": [
        "educational_purpose",
        "interactive_narrative_form",
        "if_mechanics",
        "interaction_education_relationship"
      ],
      "missing_dimensions": [
        "intended_audience",
        "application_setting"
      ]
    },
    {
      "knowledge_id": "kc-itchio-0011-v1-1",
      "project_id": "itchio-0011",
      "display_title": "HONEYMOON",
      "platform": "itch.io",
      "public_url": "https://jag.itch.io/honeymoon",
      "known_dimensions": [
        "educational_purpose",
        "intended_audience",
        "application_setting",
        "interactive_narrative_form",
        "if_mechanics",
        "interaction_education_relationship"
      ],
      "missing_dimensions": []
    },
    {
      "knowledge_id": "kc-itchio-0012-v1-1",
      "project_id": "itchio-0012",
      "display_title": "A Thousand Cuts: Early Edition",
      "platform": "itch.io",
      "public_url": "https://jag.itch.io/a-thousand-cuts-early-edition",
      "known_dimensions": [
        "intended_audience",
        "application_setting",
        "interactive_narrative_form",
        "if_mechanics"
      ],
      "missing_dimensions": [
        "educational_purpose",
        "interaction_education_relationship"
      ]
    },
    {
      "knowledge_id": "kc-itchio-0013-v1-1",
      "project_id": "itchio-0013",
      "display_title": "Project Basilisk",
      "platform": "itch.io",
      "public_url": "https://monocular.itch.io/project-basilisk",
      "known_dimensions": [
        "interactive_narrative_form",
        "if_mechanics",
        "interaction_education_relationship"
      ],
      "missing_dimensions": [
        "educational_purpose",
        "intended_audience",
        "application_setting"
      ]
    },
    {
      "knowledge_id": "kc-itchio-0020-v1-1",
      "project_id": "itchio-0020",
      "display_title": "Beyond the Silk Sea",
      "platform": "itch.io",
      "public_url": "https://mkiang.itch.io/beyond-the-silk-sea",
      "known_dimensions": [
        "educational_purpose",
        "interactive_narrative_form",
        "if_mechanics",
        "interaction_education_relationship"
      ],
      "missing_dimensions": [
        "intended_audience",
        "application_setting"
      ]
    },
    {
      "knowledge_id": "kc-itchio-0024-v1-1",
      "project_id": "itchio-0024",
      "display_title": "Aggie's Digital Art Gallery",
      "platform": "itch.io",
      "public_url": "https://3denemy.itch.io/aggies-digital-art-gallery",
      "known_dimensions": [
        "educational_purpose",
        "interactive_narrative_form",
        "if_mechanics",
        "interaction_education_relationship"
      ],
      "missing_dimensions": [
        "intended_audience",
        "application_setting"
      ]
    },
    {
      "knowledge_id": "kc-itchio-0032-v1-1",
      "project_id": "itchio-0032",
      "display_title": "One New Message",
      "platform": "itch.io",
      "public_url": "https://jag.itch.io/onm",
      "known_dimensions": [
        "intended_audience",
        "application_setting",
        "interactive_narrative_form",
        "if_mechanics"
      ],
      "missing_dimensions": [
        "educational_purpose",
        "interaction_education_relationship"
      ]
    },
    {
      "knowledge_id": "kc-itchio-0041-v1-1",
      "project_id": "itchio-0041",
      "display_title": "Microaggressions",
      "platform": "itch.io",
      "public_url": "https://usmgamestudies.itch.io/microaggressions",
      "known_dimensions": [
        "interactive_narrative_form",
        "if_mechanics",
        "interaction_education_relationship"
      ],
      "missing_dimensions": [
        "educational_purpose",
        "intended_audience",
        "application_setting"
      ]
    },
    {
      "knowledge_id": "kc-itchio-0046-v1-1",
      "project_id": "itchio-0046",
      "display_title": "Bully Busters",
      "platform": "itch.io",
      "public_url": "https://winspirationkids.itch.io/bully-busters",
      "known_dimensions": [
        "educational_purpose",
        "intended_audience",
        "interactive_narrative_form",
        "if_mechanics",
        "interaction_education_relationship"
      ],
      "missing_dimensions": [
        "application_setting"
      ]
    },
    {
      "knowledge_id": "kc-itchio-0047-v1-1",
      "project_id": "itchio-0047",
      "display_title": "PathoBytes",
      "platform": "itch.io",
      "public_url": "https://mindape.itch.io/pathobytes",
      "known_dimensions": [
        "educational_purpose",
        "interactive_narrative_form"
      ],
      "missing_dimensions": [
        "intended_audience",
        "application_setting",
        "if_mechanics",
        "interaction_education_relationship"
      ]
    },
    {
      "knowledge_id": "kc-itchio-0048-v1-1",
      "project_id": "itchio-0048",
      "display_title": "Ethemblage",
      "platform": "itch.io",
      "public_url": "https://leahgovia.itch.io/ethemblage",
      "known_dimensions": [
        "educational_purpose",
        "interactive_narrative_form",
        "if_mechanics",
        "interaction_education_relationship"
      ],
      "missing_dimensions": [
        "intended_audience",
        "application_setting"
      ]
    },
    {
      "knowledge_id": "kc-itchio-0052-v1-1",
      "project_id": "itchio-0052",
      "display_title": "Rediscovering Earth",
      "platform": "itch.io",
      "public_url": "https://cheerfulgoth.itch.io/rediscovering-earth",
      "known_dimensions": [
        "interactive_narrative_form",
        "if_mechanics",
        "interaction_education_relationship"
      ],
      "missing_dimensions": [
        "educational_purpose",
        "intended_audience",
        "application_setting"
      ]
    },
    {
      "knowledge_id": "kc-itchio-0055-v1-1",
      "project_id": "itchio-0055",
      "display_title": "Shivers Story Time – A Gentle Woodland Story Collection 🐉",
      "platform": "itch.io",
      "public_url": "https://shiversstories.itch.io/shivers-stories",
      "known_dimensions": [
        "educational_purpose",
        "intended_audience",
        "interactive_narrative_form",
        "if_mechanics",
        "interaction_education_relationship"
      ],
      "missing_dimensions": [
        "application_setting"
      ]
    },
    {
      "knowledge_id": "kc-itchio-0063-v1-1",
      "project_id": "itchio-0063",
      "display_title": "Periodicity: Your Chemical Romance",
      "platform": "itch.io",
      "public_url": "https://vanadiumvalor.itch.io/periodicity-your-chemical-romance",
      "known_dimensions": [
        "educational_purpose",
        "interactive_narrative_form",
        "if_mechanics",
        "interaction_education_relationship"
      ],
      "missing_dimensions": [
        "intended_audience",
        "application_setting"
      ]
    },
    {
      "knowledge_id": "kc-itchio-0072-v1-1",
      "project_id": "itchio-0072",
      "display_title": "Hikikomori's Journey",
      "platform": "itch.io",
      "public_url": "https://young-wave-studio.itch.io/hikikomori-journey",
      "known_dimensions": [
        "educational_purpose",
        "interactive_narrative_form",
        "if_mechanics",
        "interaction_education_relationship"
      ],
      "missing_dimensions": [
        "intended_audience",
        "application_setting"
      ]
    },
    {
      "knowledge_id": "kc-itchio-0078-v1-1",
      "project_id": "itchio-0078",
      "display_title": "Philosophy on Rails: An Introduction to the Western Canon",
      "platform": "itch.io",
      "public_url": "https://mmason.itch.io/philosophy-on-rails",
      "known_dimensions": [
        "educational_purpose",
        "interactive_narrative_form",
        "if_mechanics",
        "interaction_education_relationship"
      ],
      "missing_dimensions": [
        "intended_audience",
        "application_setting"
      ]
    },
    {
      "knowledge_id": "kc-itchio-0080-v1-1",
      "project_id": "itchio-0080",
      "display_title": "ATLAS",
      "platform": "itch.io",
      "public_url": "https://30x30.itch.io/atlas",
      "known_dimensions": [
        "educational_purpose",
        "interactive_narrative_form",
        "if_mechanics",
        "interaction_education_relationship"
      ],
      "missing_dimensions": [
        "intended_audience",
        "application_setting"
      ]
    },
    {
      "knowledge_id": "kc-itchio-0087-v1-1",
      "project_id": "itchio-0087",
      "display_title": "Mist of Madness",
      "platform": "itch.io",
      "public_url": "https://mimico-studio.itch.io/mist-of-madness-en",
      "known_dimensions": [
        "educational_purpose",
        "interactive_narrative_form",
        "if_mechanics",
        "interaction_education_relationship"
      ],
      "missing_dimensions": [
        "intended_audience",
        "application_setting"
      ]
    },
    {
      "knowledge_id": "kc-itchio-0101-v1-1",
      "project_id": "itchio-0101",
      "display_title": "Guardian of the Code",
      "platform": "itch.io",
      "public_url": "https://cirnol.itch.io/guardian-of-the-code",
      "known_dimensions": [
        "educational_purpose",